Category,Domain,Project_Name,Description,Primary_AWS_Services,Secondary_AWS_Services,Storage_Services,Implementation_Approach,Key_Differentiation,Feasibility,Market_Impact,Demo_Complexity
Conservative Ideas,Sustainable Mobility,Smart Traffic Light Optimizer,AI-powered traffic light management system using real-time vehicle detection and flow optimization,"Amazon Rekognition, AWS IoT Core, AWS Lambda","Amazon DynamoDB, Amazon CloudWatch, Amazon API Gateway",Amazon S3,"Use Rekognition to detect vehicles at intersections, IoT Core for sensor data, Lambda for processing logic",Focus on real-time optimization with AI-powered decision making vs traditional timer-based systems,"HIGH - Proven AWS services, clear implementation path","Reduce traffic congestion by 15-25%, decrease emissions, improve urban mobility",MEDIUM - Need video/image simulation for traffic scenarios
Conservative Ideas,Sustainable Mobility,Predictive Public Transit Analytics,ML-powered system to predict bus/train delays and optimize routes using real-time data,"Amazon SageMaker, AWS IoT Analytics, Amazon Bedrock","AWS Lambda, Amazon EventBridge, Amazon SNS","Amazon S3, Amazon DynamoDB","Collect GPS, weather, traffic data via IoT Analytics, train prediction models with SageMaker, use Bedrock for NLP insights","AI-driven predictions with multi-modal data integration (GPS, weather, events, social media)","HIGH - Well-established ML patterns, good data availability","Improve punctuality by 20%, enhance passenger experience, optimize fleet management",MEDIUM - Can simulate with synthetic transit data
Conservative Ideas,Sustainable Mobility,Smart Parking Management System,Computer vision and IoT-based solution for real-time parking space detection and reservation,"Amazon Rekognition, AWS IoT Core, Amazon API Gateway","AWS Lambda, Amazon DynamoDB, Amazon CloudFront",Amazon S3,"Camera feeds processed by Rekognition for space detection, IoT sensors for occupancy, API Gateway for mobile app integration",Real-time CV-based detection combined with predictive availability and mobile integration,"HIGH - Mature computer vision capabilities, clear use case","Reduce parking search time by 40%, decrease urban congestion, improve user experience",LOW - Easy to simulate with parking lot images/videos
Conservative Ideas,Smart Food Factories,Quality Control AI Inspector,Automated visual inspection system for food products using computer vision and defect detection,"Amazon Rekognition Custom Labels, Amazon SageMaker, AWS IoT Core","AWS Lambda, Amazon DynamoDB, Amazon SNS",Amazon S3,"Train custom vision models with Rekognition Custom Labels, deploy via SageMaker endpoints, integrate with production line IoT",AI-powered quality control with real-time defect classification and automated rejection systems,"HIGH - Proven computer vision approach, clear ROI","Reduce defective products by 30%, decrease manual inspection costs, improve food safety",MEDIUM - Need food product images for training/demo
Conservative Ideas,Smart Food Factories,Predictive Equipment Maintenance,ML system to predict machinery failures and optimize maintenance schedules in food production,"Amazon SageMaker, AWS IoT Analytics, Amazon Timestream","AWS Lambda, Amazon EventBridge, Amazon CloudWatch",Amazon S3,"Collect sensor data via IoT Analytics, store time-series data in Timestream, build predictive models with SageMaker",AI-driven maintenance scheduling with multi-sensor fusion and cost optimization,HIGH - Established IoT and ML patterns,"Reduce unplanned downtime by 25%, optimize maintenance costs, extend equipment lifecycle",MEDIUM - Can simulate with synthetic sensor data
Conservative Ideas,Smart Food Factories,Intelligent Inventory Optimization,AI-powered system for optimizing raw material inventory based on production forecasts and market demand,"Amazon Bedrock, Amazon SageMaker, Amazon Forecast","AWS Lambda, Amazon API Gateway, Amazon EventBridge","Amazon S3, Amazon RDS","Use Bedrock for demand analysis from market data, Forecast for time-series predictions, SageMaker for optimization models",GenAI-powered market analysis combined with traditional forecasting and optimization algorithms,HIGH - Combines multiple AWS AI services effectively,"Reduce waste by 20%, optimize inventory costs, improve production planning",LOW - Can work with synthetic inventory/demand data
Disruptive Ideas,Sustainable Mobility,AI Urban Mobility Orchestrator,"City-wide AI agent system that dynamically coordinates traffic, public transit, emergency services, and infrastructure","Amazon Bedrock Agents, AWS Step Functions, Amazon Bedrock","AWS IoT Core, Amazon Kinesis, Amazon Lambda@Edge","Amazon Neptune, Amazon S3, Amazon DynamoDB","Deploy AI agents using Bedrock Agents for different city systems, orchestrate with Step Functions, use Neptune for city knowledge graph",Multi-agent AI system that treats entire city mobility as interconnected ecosystem with autonomous decision-making,"MEDIUM - Cutting-edge agent orchestration, complex integration","Transform urban mobility efficiency by 40%+, enable fully responsive smart cities",HIGH - Requires complex city simulation environment
Disruptive Ideas,Sustainable Mobility,Autonomous Fleet Coordination Network,"AI system for coordinating autonomous vehicles, delivery drones, and micro-mobility options in real-time","Amazon Bedrock, AWS Step Functions, Amazon SageMaker","AWS IoT Core, Amazon Kinesis, AWS Lambda@Edge","Amazon Neptune, Amazon S3","AI agents for each vehicle type, real-time coordination via Step Functions, edge computing for ultra-low latency decisions",First-of-kind multi-modal autonomous fleet coordination with AI-driven route optimization and conflict resolution,MEDIUM - Requires sophisticated AI orchestration,"Enable seamless autonomous mobility ecosystem, reduce transportation costs by 50%",HIGH - Complex multi-agent simulation required
Disruptive Ideas,Sustainable Mobility,Carbon-Optimal Route Intelligence,AI system that optimizes transportation routes across all modes for minimum carbon footprint using real-time environmental data,"Amazon Bedrock, Amazon SageMaker, AWS IoT Analytics","Amazon Forecast, AWS Lambda, Amazon API Gateway","Amazon Timestream, Amazon S3","Integrate environmental sensors, weather APIs, traffic data; use Bedrock for complex carbon footprint reasoning and route optimization",First AI system to optimize for carbon footprint across all transportation modes with real-time environmental intelligence,MEDIUM - Requires complex environmental data integration,"Reduce transportation carbon emissions by 30%, drive sustainable mobility adoption",MEDIUM - Need environmental data simulation
Disruptive Ideas,Smart Food Factories,Autonomous Food Factory Orchestrator,AI agent system that autonomously manages entire food production line from ingredient sourcing to packaging,"Amazon Bedrock Agents, AWS Step Functions, Amazon Bedrock","AWS IoT Core, Amazon Rekognition, Amazon SageMaker","Amazon Neptune, Amazon S3, Amazon DynamoDB","Deploy specialized AI agents for sourcing, production, quality, packaging; orchestrate with Step Functions, use Neptune for supply chain knowledge",First fully autonomous food factory with AI agents handling complex decision-making across entire production lifecycle,MEDIUM - Cutting-edge agent coordination in industrial setting,"Enable lights-out food production, reduce labor costs by 60%, improve consistency",HIGH - Requires comprehensive factory simulation
Disruptive Ideas,Smart Food Factories,AI-Driven Sustainable Food Design,"GenAI system that designs new food products optimized for nutrition, taste, sustainability, and manufacturing efficiency","Amazon Bedrock, Amazon SageMaker, AWS Batch","AWS Step Functions, Amazon API Gateway, AWS Lambda","Amazon S3, Amazon RDS","Use Bedrock for creative food design, SageMaker for nutritional optimization, Batch for large-scale recipe simulation and testing","AI-generated food products with multi-objective optimization (taste, nutrition, sustainability, manufacturability)",HIGH - Leverages generative AI creatively with clear optimization targets,"Accelerate healthy food innovation by 10x, reduce R&D costs, enable personalized nutrition",LOW - Can demonstrate with recipe generation and nutritional analysis
Disruptive Ideas,Smart Food Factories,Global Food Supply Chain Intelligence,AI system providing real-time intelligence and autonomous decision-making across global food supply networks,"Amazon Bedrock, AWS Step Functions, Amazon Neptune","AWS IoT Analytics, Amazon Forecast, Amazon QuickSight","Amazon S3, Amazon Timestream","Build global supply chain knowledge graph in Neptune, use Bedrock for complex reasoning about disruptions and opportunities",First AI system providing autonomous decision-making for global food supply chains with predictive disruption management,MEDIUM - Requires complex global data integration,"Reduce food waste by 25%, optimize global food distribution, improve food security",MEDIUM - Need supply chain data simulation
